Name , Prize 
   
Galaxy S25 Cell Phone, 128GB AI Smartphone, Unlocked Android, AI Camera, Fast Processor, ProScaler Display, Long Battery Life, 2025, US 1 Yr Manufacturer Warranty, Mint  $699.99$699.99 
Galaxy A35 5G A Series Cell Phone, 128GB Unlocked Android Smartphone, AMOLED Display, Advanced Triple Camera System, Expandable Storage, Rugged Design, US Version, 2024, Awesome Lilac  $324.99$324.99 
   
Galaxy S24 FE AI Phone, 128GB Unlocked Android Smartphone, High-Res 50MP Camera, Long Battery Life, Brighter Display Screen, US Version, 2024, US 1 Yr Manufacturer Warranty, Graphite  $499.99$499.99 
   
   
   
Galaxy A16 5G A Series Cell Phone, Unlocked Android Smartphone, Large AMOLED Display, Durable Design, Super Fast Charging, Expandable Storage, US Version, 2025, Blue Black  $174.99$174.99 
Galaxy A35 5G A Series Cell Phone, 128GB Unlocked Android Smartphone, AMOLED Display, Advanced Triple Camera System, Expandable Storage, Rugged Design, US Version, 2024, Awesome Navy  $324.99$324.99 
   
Galaxy A15 (SM-155M/DSN), 128GB 6GB RAM, Dual SIM, Factory Unlocked GSM, International Version (Wall Charger Bundle) (Light Blue)   
X24 Ultra 5G Cell Phone, Unlocked Android Smartphone, 8GB+256GB+128GB Unlocked Android Phone, 6800 mAh Battery Super Endurance, 108MP Camera, 6.8" Display, Dual SIM, US Version, GPS (Titanium Gray)   
Galaxy A15 A155M 128GB Dual-SIM GSM Unlocked Android Smartphone (Latin America Version) - Blue Black   
Galaxy A05 A055M 64GB Dual-SIM GSM Unlocked Android Smartphone (Latin America Version) - Black   
Galaxy S25 Cell Phone, 256GB AI Smartphone, Unlocked Android, AI Camera, Fast Processor, ProScaler Display, Long Battery Life, 2025, US 1 Yr Manufacturer Warranty, Navy  $759.99$759.99 
Galaxy S24 Ultra Cell Phone, 256GB AI Smartphone, Unlocked Android, 200MP, 100x Zoom Cameras, Long Battery Life, S Pen, Global Version, 2024 - Titanium Black   
C24 Ultra 5G Smartphone, 6+256GB Unlocked Phone,48+108MP Zoom Camera，6800mAh 6.8" HD Screen Unlocked Cell Phone, 6+256GB Android13.0,Face ID/Fingerprint Lock/GPS (White)   
Galaxy A05 (128GB, 4GB) 6.7" Dual SIM Fully Unlocked Global 4G LTE A055M/DS (Black)   
Galaxy A15 (SM-155M/DSN), 128GB 6GB RAM, Dual SIM, Factory Unlocked GSM, International Version (Ring Grip Case Bundle) (Light Blue)   
Galaxy A05s (128GB, 4GB) 6.7" Dual SIM GSM Unlocked Global 4G LTE A057M/DS (Black)   
Galaxy Z Flip 6 AI Cell Phone, 512GB Unlocked Android Smartphone, FlexCam, Photo Assist, Camcorder Mode, Live Interpreter, Foldable Design, 2024, US 1 Yr Manufacturer Warranty, Silver Shadow  $949.98$949.98 
   
C24 Ultra 5G Smartphone,6+256GB Unlocked Phone, Android 13.0，48+108MP Zoom Camera,6.8" HD+ Display, Long Battery Life 6800mAh,Dual SIM 5G Cell Phone, Dual SIM,Build-in Pen Phone (Green)   
Galaxy A14 5G A Series Cell Phone, Factory Unlocked Android Smartphone, 64GB w/Expandable Storage, Long Battery Life, 13MP Camera, 6.6" Infinite Display Screen, US Version, 2023, Black   
   
   
Galaxy A25 5G A256E 128GB Dual-SIM GSM Unlocked Android Smartphone (Latin Variant/US Compatible LTE) - Blue   
Galaxy S21 FE, 128GB, Graphite, Factory Unlocked, New   
Galaxy A35 5G A356E 256GB Dual-SIM GSM Unlocked Android Smartphone (Latin Variant/US Compatible LTE) - Awesome Lilac   
   
   
   
Reno 11 Pro Unlocked Android Phone 6.7-inch HD LCD Unlocked Cell Phone 8GB+256GB Android 13 Smartphone 6000 mAh Large Battery Unlocked Phone 50MP+13MP Camera 5G Dual SIM (4G, Rock Grey)   
   
   
